Id,Months,Likes,Comments,Post,Url,Media,Original,Type,Mention,Effort
1,10,5,1,"Which products are often purchased together? That's a question you can very easily answer using Tableau and a handful of LOD calculations. If you are curious about the interactive dashboard, check this link: https://lnkd.in/dxRUHV8 Feel free to download it and check the calculations. If you have any questions, I am happy to help!",https://www.linkedin.com/posts/jmperafan_tableau-marketbasketanalysis-juanalytics-activity-6458254303512522752-6s9p,Image,TRUE,Display,,
2,9,12,3,"Exactly 30 weeks ago, I decided to join hashtag#makeovermonday for the very time. Today, I decided to create a more polished version that same dashboard. This is how much my Tableau skills have improved during that time. Link: https://lnkd.in/gZEZBCF hashtag#tableau hashtag#juanalytics",https://www.linkedin.com/posts/jmperafan_makeovermonday-tableau-juanalytics-activity-6464547217381294080-CGXf,Image,TRUE,Accomplishment,,
3,9,18,0,Marketoonist strikes again! hashtag#juanalytics,https://www.linkedin.com/posts/jmperafan_juanalytics-activity-6465216385613070336-2MnC,Image,FALSE,Joke,Marketoonist,
4,9,17,0,"I made a Tableau workbook with 8 different types of maps. Feel free to download it if you want to reverse engineer how it is done. Alternatively, send me a message, I am always happy to help. Link: https://lnkd.in/dFa8ct5 hashtag#juanalytics",https://www.linkedin.com/posts/jmperafan_juanalytics-activity-6467310520893472768-4CK4,Image,TRUE,Display,,
5,9,14,1,"In 1973, the statistician Frank Anscombe taught us the importance of going beyond statistical data analysis. In one of his most renowned papers, he published four datasets with nearly identical descriptive statistics. These datasets had similar means, variances, correlation, and even regression coefficients; but only when they were plotted, they all told a very different story. Recently, Alberto Cairo created a dataset called the Datasaurus Dozen (known by many as the Anscombesaurus) illustrating the same principle. Here is a small tribute I made to both of them. Click on the link to play with the 17 graphs from both of these datasets. I purposed added the summary statistics on top (with 4 decimals points) to truly appreciate how exact they are. https://lnkd.in/dZ6DgBT hashtag#juanalytics",https://www.linkedin.com/posts/jmperafan_juanalytics-activity-6468900292325838848-DOf-,Image,TRUE,Display,,
6,9,4,0,"Maps can be pleasant to look at and they have a wow factor. But, from a very strict design perspective, using maps for data visualization is not a great idea. Maps tend to give visual priority to bigger land masses. Just to give an easy example, Russia covers almost 20% of the land on a world map. While some countries in northern Europe are barely visible. One of my favorite alternatives is hexagon maps. It doesn't work as well for Europe as it does for the US though. Feel free to download this workbook and reuse this map: https://lnkd.in/epSBwRK hashtag#juanalytics",https://www.linkedin.com/posts/jmperafan_juanalytics-activity-6469142483602325504-ZKtn,Image,TRUE,Display,,
7,9,12,0,"These are all of the places I've lived in my (so far) 26 years. I added Brussels as a joke (I still live in Utrecht, even though I spend all most of my time here in Belgium nowadays). Once again, feel free to download the workbook and reuse it with your own data: https://lnkd.in/dWexAfY hashtag#vizmylife hashtag#tableau hashtag#juanalytics",https://www.linkedin.com/posts/jmperafan_vizmylife-tableau-juanalytics-activity-6469228206028259328-UlU1,Image,TRUE,Display,,
8,9,45,5,"Contrary to what many think, I would dare to argue that scatterplots are usually the wrong plot for your data. Scatterplots are great when there is a very clear trend (like a correlation) or when you are working with a small dataset. But even then, you can't avoid overlapping points. Besides, you really don't care about the exact coordinates of your points, you usually care about the distribution anyway. My advice is to start using hexbins! Link: https://lnkd.in/gZEZBCF hashtag#tableau hashtag#juanalytics",https://www.linkedin.com/posts/jmperafan_tableau-juanalytics-activity-6470187242814992384-YLUq,Image,TRUE,Display,,
9,9,20,4,"Another way to prevent overlapping dots in circle views is to add a small amount of random variation to the location of each point. This variation is known as jitter. In Tableau, you can accomplish this by using RANDOM(). This function generates a random value between 0 and 1. Interestingly, you can't really find this function in the documentation and it is barely mentioned anywhere. I believe it has something to do with the fact that it is not usually supported by databases. Honestly, jitter plots are still a quick and dirty way of preventing overlap. It is not something I would highlight as a best practice... But I love to mention it just because of the RANDOM() function. P.S. You can also make jitter plots using the INDEX() function, but it is a bit less quick and the results don't look always look ""random enough"". https://lnkd.in/gZEZBCF hashtag#tableau hashtag#juanalytics",https://www.linkedin.com/posts/jmperafan_tableau-juanalytics-activity-6470586762988134400-m8g9,Image,TRUE,Display,,
10,9,57,17,"""So if you studied Psychology, how did you end up working in Data?"" I made a timeline showing how all my university studies, online courses, and all of my many career changes eventually took me to where I am right now. Check the link and hover above the dots to understand it better: https://lnkd.in/dUKV5qT hashtag#juanalytics",https://www.linkedin.com/posts/jmperafan_juanalytics-activity-6470931307395325952-QGaA,Image,TRUE,Accomplishment,,
11,9,13,6,"Word clouds in a scatterplot are generally a bad idea and you should avoid unreadable marks. There is one exception: Highlighting points that are absurdly far from the rest. I could have made several choices to make the plot more readable and to allow my reader to be able to search a particular driver. I could have made the X-axis longer on the negative side, shorten the driver's name, or just use another type of plot... But I purposely didn't. If it makes sense for your narrative, you don't always have to make every point visible. Link: https://lnkd.in/dEx-S33 I have seen this same principle being used in this visualization of the external debt of each country: https://lnkd.in/dBKz9NV hashtag#juanalytics",https://www.linkedin.com/posts/jmperafan_juanalytics-activity-6471265949902209024-9kVB,Image,TRUE,Display,,
12,9,88,9,"1.645, 1.96, and 2.576. If you are a Tableau user and these numbers seem familiar to you, you have probably realized that Tableau has no easy way of making a visualization to test for statistical significance. The closest thing you can make is a boxplot (based on median and quartiles), but sometimes you might want an error plot (based on the mean and the variance). And I know that p-values are conceptually flawed and the median is almost always better than the mean, but it never hurts to try: https://lnkd.in/dqxu5rh P.S. I have to give credit to Steve Wexler for this one! Check his whitepaper, videos, and his Tableau Public. He is the authority when it comes to visualizing survey data. hashtag#juanalytics",https://www.linkedin.com/posts/jmperafan_juanalytics-activity-6471682038666661888-hwoy,Image,TRUE,Display,Steve Wexler,
13,9,1,0,"To Sankey or not to Sankey? I will have to agree with Chris on this one. However, I would highly recommend anybody learning Tableau to do it as an exercise and take your time to learn why it works. Making a Sankey Chart really helped me understand data densification, why bins are so awesome, and how to create advanced table calculations without guessing. hashtag#juanalytics",https://www.linkedin.com/posts/jmperafan_sankey-diagrams-the-new-pie-chart-activity-6471808352912437248-IUQg,Link,FALSE,Opinion,Chris Love,
14,9,36,4,"I finally had time to create my own version of Ludovic Tavernier's multi-layer radial chart. Check the link if you haven't done so yet: https://lnkd.in/d2B7jtv Even though I messed up one of the layers, following along was insanely insightful. I had no idea it was possible to work with layers inside the same visualization. When I first saw this chart at the TC, I thought it was floating charts on top of each other. This chart is probably not the best if you want to make precise comparisons between any two points and it can be difficult to interpret. But I still believe it is the best of many worlds. It can display hundreds of data points at the lowest granularity without any overlap nor scrollbars and the design looks stunning. Make sure to give it a try! hashtag#juanalytics",https://www.linkedin.com/posts/jmperafan_juanalytics-activity-6472696434780045312-0ysI,Image,TRUE,Display,Ludovic Tavernier,
15,9,10,0,"When I was a kid, I dreamt of a job that involved staying in hotels. Mission accomplished. In this last semester, I have seen all sorts of hotels. Hotels full of strangers' hair and stains (never stay at the Siru Hotel in Brussels), hotels with a panic button (which I shouldn’t have pressed), and even hotels with a shower next to your bed. Regarding the viz: I am not a huge fan of maps, they are absurdly space inefficient. Most of my hotels are located on the same streets (you could probably triangulate my work), but some are also located further away. Consequently, the only way to retain some details was to split the map. But I am not 100% happy with the end product though. Here is the link: https://lnkd.in/dPgTGGG Also noteworthy, I was playing with the Mapbox API. I went for the very boring Google Maps style, but they have thousands of options. Make sure to check it out! hashtag#tableau hashtag#juanalytics",https://www.linkedin.com/posts/jmperafan_tableau-juanalytics-activity-6473120523462152192-F2nf,Image,TRUE,Display,,
16,9,29,3,"Ever since I saw this viz: https://lnkd.in/dUwqVQx I have been particularly fascinated with the idea of creating 3D visualizations in Tableau. Not because it is particularly pretty or insightful, but because it requires a high level of mastery of polygons, data densification, and table calculations. And as you can see from my first attempt, I still have some way to go. If you are curious about using Tableau for 3D graphs, make sure to read this article by Bora Beran: https://lnkd.in/ddgbStp hashtag#juanalytics",https://www.linkedin.com/posts/jmperafan_juanalytics-activity-6473469933404581889-F8Tz,Image,TRUE,Display,Bora Beran,
17,9,38,5,"Are the titles of self-help books really that predictable? A while back, speaking to my good friend Tony, we were joking about this. So, as any normal person would do, I decided to scrape and analyze the titles and descriptions of hundreds of self-help books while I was on the train. If you are interested in learning the basics of text mining (bag of words, sentiment analysis, etc), I couldn't recommend you enough to check out this book: https://lnkd.in/eqmqFQg Here is the link to this dashboard: https://lnkd.in/enS8vWr hashtag#tableau hashtag#juanalytics",https://www.linkedin.com/posts/jmperafan_tableau-juanalytics-activity-6473843238586372096-a_kU,Image,TRUE,Display,Tony Zeljkovic,
18,9,45,6,"Last year: ""I am learning D3.js, Ggplot2, and Seaborn because they can do more types of graphs than Tableau"" Last semester: ""Density plots, dendrograms, Ridgeline Plot, and a couple more are not possible in Tableau"" Last month: ""I still don't know how to do a principal component analysis scatterplot in Tableau... But I am sure there is a hacky way of doing it"" Think about it, graphs are just pixels in a Cartesian plane. If you know what coordinates to color and how to connect each dot, you can build anything you can imagine. It is not a matter of something being possible, but rather easy or practical. Ken Flerlage explains this concept a lot more eloquently than me in his blog. Make sure to read every article from the ""Beyond Show Me"" and ""SQL for Tableau"" series. They are gold! https://lnkd.in/dPD5-Da The graph you are seeing below is PCA scatterplot. Using dimensionality reduction, you can visualize more than 2 measures in a 2-dimensional plane. They are not aesthetically pleasing, but I really like the concept. They are also surprisingly easy to make using R. hashtag#juanalytics",https://www.linkedin.com/posts/jmperafan_juanalytics-activity-6474202675729690625-LyOg,Image,TRUE,Display,Ken Flerlage,
19,8,20,1,"I was playing last night with my LinkedIn data and I managed to find some interesting insights. I spent quite a bit of time analyzing the differences between the messages I get from recruiters compared to my other contacts. Here are some of my findings: 1) Most messages in Dutch are from recruiters. 2) I speak more often about R, Python, and Tableau with my contacts. 3) Recruiters use broader terms like ""analyst"" and ""data scientist"". 4) ""Hey"" is probably the best predictor that you are not a recruiter. 5) Recruiters are more interested in my marketing experience. 6) Almost half of my messages include the word data (I had to exclude it from the scatterplot). This doesn't count as a finding, but 1.28% of the recruiters spelled my name wrong. Guan? Yuan? Seriously? It is literally in front of their nose! Link to the dashboard: https://lnkd.in/dfNP3Hj hashtag#juanalytics",https://www.linkedin.com/posts/jmperafan_juanalytics-activity-6475232218758283264-0rLu,Image,TRUE,Display,,
20,8,3,1,"Size matters, at least when it comes to graphs. While details get lost in a small canvas, a big canvas can really exaggerate and dramatize differences. Today's graph was inspired by one particular video. It is called ""The Fallen of World War II"" and it is the best data storytelling video I have ever seen. I would dare to say that this one video made me fall in love with information design in the first place: https://lnkd.in/d4tSFex Here is the link to my own version: https://lnkd.in/dg52wHU hashtag#tableau hashtag#juanalytics",https://www.linkedin.com/posts/jmperafan_tableau-juanalytics-activity-6475651840515010561-HS4m,Image,TRUE,Display,,
21,8,46,4,"Behold the most cliche chart in the history of Tableau: Superstore's profit per month. If you are an intermediate or advanced Tableau user, it is widely known that the profit is on a rising trend. But have you noticed how the Superstore struggles to find new clients? These types of insights are the reason I think LOD calculations the most powerful feature in Tableau (although Set Actions are very close). If you want to learn more about LOD, these are my top choices: 1) Bethany Lyons article: https://lnkd.in/dHS6yeb 2) This Udemy course created by R-Tutorials: https://lnkd.in/dzBRb8i hashtag#tableau hashtag#juanalytics",https://www.linkedin.com/posts/jmperafan_tableau-juanalytics-activity-6476000813075435520-0ZmU,Image,TRUE,Display,Bethany Lyons,
22,8,5,0,"Combining a waffle chart with the infamous ""The World with 100 People"" dataset. In my head, this graph seemed like a great idea. But it is a terrible graph. However, instead of discarding it, I have decided to share it with you and explain what makes it so bad. First of all, let's start with the elephants in the room. Namely, flags are not necessarily are the best tool to represent languages, most of the values are ""Other"", and this dataset is very old. Secondly, this graph doesn't allow us to find interesting patterns in the data. Thirdly, nothing you might want to do with this graph is ""effortless"". You can't easily make comparisons, calculate the total, nor see the data from different granularity levels. In fact, if you don't know the flags of the world by heart, you will probably have trouble reading this graph. Finally, it is not space nor ink efficient. This graph is a lot less efficient and confusing than just writing down the outcomes in bullet points. I hope you all learned from this graph. I will start commenting on bad graphs in the future as well! You can learn a lot from them. Here is the link to the dashboard: https://lnkd.in/dDUyTea hashtag#tableau hashtag#juanalytics",https://www.linkedin.com/posts/jmperafan_tableau-juanalytics-activity-6476388586869522432-7q17,Image,TRUE,Display,,
23,8,19,1,"I made a really cool dataset last night! I applied sentiment analysis to the descriptions of millions of movies from 1900 until 2017. It contains features like the genre, director, cast, director, and release year. I will be using it in the coming weeks for my graphs. The graph you see below is the average sentiment score of each movie from 1997 until 2017 (did you know Tableau Public has a limit of 15k rows? Neither did I!). As you might expect with any big sample, positive and negative movies even each other out. Additionally, to avoid spoilers, most descriptions speak more about the conflict of the plot (generally bad) and less about the resolution (generally good). So a slight bias for negativity was expected. The only exception for the Philippines, their movies have a surprising skewness towards the positive side. I have no idea why! https://lnkd.in/dXTrUPJ hashtag#tableau hashtag#juanalytics",https://www.linkedin.com/posts/jmperafan_tableau-juanalytics-activity-6476725979610906624-1ZIm,Image,TRUE,Display,,
24,8,22,8,"When I first started using Tableau, it would frustrate me that you couldn't just simply use formulas like the ones below: NL = df[df.Country=='Netherlands'] NL <- filter(df, Country == ""Netherlands"") Later, I learned this is definitely possible, you just need a different approach. In relational algebra, the right solution is to transform the values you don't need into NULL and then append that one value to each row in a new column. Here is how that formula looks like in Tableau: AVG ( { MAX( IF [Field] = ""Value1"" // AND [Field] != ""Value2"" THEN { fixed [Field] : AGG([Measure]) } END ) } ) The syntax is not particularly elegant and you are all probably wondering: Why is there an AVG and then a MAX at the beginning? Let's start with the MAX. Tableau FORCES you to use an aggregate, but it really doesn't matter if you use MIN, MAX, AVG, or MEDIAN if there is only one value. I personally use MAX because that's how I roll (my glass is half-full), but it is fine if you use any of them. Except for SUM. The whole reason you should avoid using SUM and also why it is a wise idea to wrap the formula with an AVG is to avoid problems with duplicates. Confusing? I know. If you want to learn more check out this course: https://lnkd.in/daFnbpk hashtag#juanalytics",https://www.linkedin.com/posts/jmperafan_juanalytics-activity-6477783497816702976-jZiq,Image,TRUE,Display,,
25,8,8,0,"Last week, I used this same dataset (sentiment score of the description of the millions of movies) to show how sentiment changes per culture. That graph was built using the heatmap functionality of Tableau. Today, I bring you a graph with the sentiment analysis score of American horror movies throughout the years. This time, I used a normal scatterplot. This obscures the overall distribution and the overlaps, but it highlights the outliers (the movies with a very positive or negative sentiment). It is a trade-off you always have to make: Do you care more about outliers or distribution? Fun facts: 1) ""Hellraiser: Bloodline"" was the most negative movie. Mostly due to the graphic description of each death. Also, the words ""hell"" and ""kill"" appeared quite often. 2) There are 3 versions of Dr. Jekyll and Mr. Hyde between 1910 and 1920. 3) Slashers tend to have lower sentiment scores, while typical suspense thrillers tend to have neutral scores. Mostly because thrillers have a tendency to convey feelings instead of literally mentioning them. Link to the interactive dashboard: https://lnkd.in/eQSkK7J hashtag#tableau hashtag#juanalytics",https://www.linkedin.com/posts/jmperafan_tableau-juanalytics-activity-6478188166040875008-FwkA,Image,TRUE,Display,,
26,8,6,0,"BI is one of the most diverse disciplines out there. It truly attracts people from every background. However, I truly believe that, from all of the disciplines that make out data visualization, there is an underrepresentation from UX/UI design, graphic designers, and cartography in the community. It is honestly hard to find good resources teaching you how to make a pretty dashboard. That's why I am more than happy to share with all of you this design guide. I don't know them, but the two authors really have an eye for design. hashtag#juanalytics",https://www.linkedin.com/posts/jmperafan_ai-iot-design-activity-6478269676303503361-qdwc,Image,TRUE,Opinion,,
27,8,106,13,Great news! I am fully certified in Tableau Desktop! Are you considering becoming hashtag#tableau certified? Check this short article I wrote: https://lnkd.in/djE53m6 I will probably make a more complete overview in the coming days. hashtag#juanalytics,https://www.linkedin.com/posts/jmperafan_tableau-juanalytics-activity-6478559019224043520-Q_dB,Image,TRUE,Accomplishment,,
28,8,23,2,"In design, highlighting is not just about making one element more appealing than the rest. A big part of it is making everything else unremarkable. It hasn't always been the case, but gray has become my favorite color. It is not particularly aesthetically pleasing, but it is key to unlock the power of other colors I also like (e.g. red, blue, or purple). Well, at least when you are designing on a white or black background. As for the graphs: On top, you have the *almost* out of the box graph that you would get from Tableau. Full of annoying lines, unnecessary subtitles, and absurdly long numbers. Down under, you can see my attempt to making the rest unremarkable. hashtag#tableau hashtag#fiftyshadesofgrey hashtag#visualhierarchy hashtag#juanalytics",https://www.linkedin.com/posts/jmperafan_tableau-fiftyshadesofgrey-visualhierarchy-activity-6478942985059909632-Fl2j,Image,TRUE,Display,,
29,8,10,1,"Tableau invested a lot of time and effort creating and selecting their default colors palettes and fonts. Wedgewood blue, Carrot orange, Mandy red, Neptune green, and Fern green (in that same order) are not pretty colors nor they don't work together to create a harmonious design. These colors are there because they are particularly easy to distinguish from each other. Same goes with their Tableau font family (e.g. Tableau book). It is not particularly pretty, but it is highly optimized for readability. Tableau even made an article explaining the thought process that went to their font creation: https://lnkd.in/dhDEruy I personally have nothing to say against these fonts and colors. They are great from a functional design perspective. But I do have a small problem with using defaults. No matter how good, the default option conveys that you didn't invest that much effort into something. It seems a bit careless, unexceptional, and even sloppy. I might make a post about color palettes in the future. For now, here is a list of my favorite Tableau fonts. I would like to hear from you: Which fonts do you usually use in your dashboards? hashtag#design hashtag#tableau hashtag#font hashtag#juanalytics",https://www.linkedin.com/posts/jmperafan_design-tableau-font-activity-6479308032760119296-ZYi8,Image,TRUE,Display,,
30,8,14,1,"I love shapes! The ability to add custom shapes gives a lot of control over the look of your viz. However, a lot of people forget that you can also use Unicode Characters inside of your calculations. For example, I used this calculation to make the heatmap you see below: IIF( SUM([Profit]) > 0, NULL, ""☠"" ) Shapes are great! But, if black and white will do for you, I would advise you to use Unicode Characters. They don't require you to use an axis, you have more control over the placement, and they fit better inside of a crosstab. Here is a big list of nice Unicode Characters: https://lnkd.in/dBbNq47 hashtag#tableau hashtag#unicode hashtag#juanalytics",https://www.linkedin.com/posts/jmperafan_tableau-unicode-juanalytics-activity-6480382262163574784-MfoG,Image,TRUE,Display,,
31,8,24,3,"Mean or Median? Most people prefer the Mean, but the Median is the true rockstar! Think about it. Have you ever heard of a single case in which the Mean was better suited than the Median as a measure of central tendency? Sure, the Mean is easier to calculate by hand and it is essential for significance testing. But the Median is robust to outliers and it is more intuitive to understand. Have you ever heard of a Truncated Mean (also known as Trimmed Mean or Windsor Mean)? That's just like putting duct tape to make the Mean behave more like the Median. Just use the Median instead of taking the trouble. Feel free to add to this discussion in the comments. I am genuinely curious about your thoughts. hashtag#stats hashtag#juanalytics",https://www.linkedin.com/posts/jmperafan_stats-juanalytics-activity-6480745123826147328-rgS2,Image,TRUE,Display,,
32,8,36,3,"Tableau Public Tip: Using Google Sheets as your data source allows to keep your data synchronized (one extract refresh per day). Exactly like if you were working with Tableau Server and a database, but it is completely free. Meaning that you don't need to re-upload a workbook when the data changes. You can just simply change it directly in your drive and it will be updated on the next day. Additionally, this allows you to harnesses the power of calculations like =TODAY() in your dashboards. I have used this trick to keep track of some hobbies and life events in my Tableau Public profile. This is my favorite example: https://lnkd.in/dsbkZBi hashtag#tableau hashtag#juanalytics",https://www.linkedin.com/posts/jmperafan_tableau-juanalytics-activity-6481090563583012864-TX3l,Image,TRUE,Display,,
