Id,Months,Likes,Comments,Post,Url,Media,Original,Type,Mention,Effort
69,6,32,1,"Dear data people, are you wondering if a company is a good match for you? Here are 3 tips. 1) Check how many Senior programmers, data scientists, digital marketers (or whatever profession with a big skills gap) work there. It is a great sign if they have been working there for more than 2 years. That means that the job is challenging, fun, and/or the salaries are great. 2) Check how many data people work there. If you are the very first, that company is probably not ready for ML. If you have no knowledge of data engineering, you will most likely end up making reports out of messy Excel files. 3) Go to their website using your mobile phone. If the site looks bad that is a big red flag. Companies struggling with anything digital might not consider your work a priority. hashtag#juanalytics",https://www.linkedin.com/posts/jmperafan_juanalytics-activity-6503176041589153792-SVT_,Image,TRUE,Opinion,,FALSE
70,6,1,0,"Dear intermediate and advanced Tableau users, Timothy Vermeiren, current IronViz champion, will be giving a webinar. He will share some of his tips and tricks with us. Make sure not to miss it. hashtag#tableau hashtag#juanalytics",https://www.linkedin.com/posts/jmperafan_want-to-learn-exciting-new-visual-analytics-activity-6503554649180696576-cfb0,Link,FALSE,Opinion,Timothy Vermeiren,FALSE
71,6,9,3,"The most fascinating Business Intelligence concept to me is the single version of the truth (SVOT). The idea of having a centralized source that produces valid and unarguable results. It is the database equivalent of “finding your true love”. We have all fantasized about it, we vaguely know how it looks, we do not know how to get there, and we secretly suspect it is just a myth. I will not get into this discussion, but I want to share with you some aha-moments I have had during my BI career. 1. If there is manual work in your data, you are doing it wrong: Don’t make it too easy for people to mess up your data. Do you know how easy it is to type a comma instead of a dot? 2. Document your KPIs: Everybody has a different idea of how to calculate a KPI. Do you remove frequent clients? Do you count internal traffic? Do you count it when they pay or when we deliver? Discuss these decisions with the stakeholders, think of alternative ways to calculate the same KPI, document it, and make the results available for everybody. 3. Analysts will always find a way: I have heard stories of people hosting their own servers, web scrapping their own CRM, or manually typing the numbers into Excel. You can’t avoid it so you might as well facilitate self-service. hashtag#juanalytics",https://www.linkedin.com/posts/jmperafan_juanalytics-activity-6503939918631305216-ZRVR,Image,TRUE,Opinion,,FALSE
72,6,125,11,"SELECT Client, AVG(Profit) AS Avg_Profit FROM Orders GROUP BY Client HAVING Avg_Profit > 0 This query is wrong, but it was fascinating to me when I found out why. Queries are evaluated in a particular order (i.e. Order of Operations). This might seem confusing at first because this order is different to order in which you type them. Going back to our query, SQL has to do the HAVING clause before it reads the SELECT in which you defined Avg_Profit. SQL does not know about that alias at that point, but this is hard for me to know since I had to define it so early in the process. Tableau takes this concept some levels beyond. LOD calculations, data source filters, quick filters, context filters, table calculations, blending, and the list goes on. I will not go that much into detail on this today; I might make a post about it in the future. In the meantime, if you want to learn more about the order of operations, check out these links: Order of Operation in Tableau (cheat sheet) by Fabian Zimmer: https://lnkd.in/dyfe_n4 Order of Operations in SQL by Robert Crocker: https://lnkd.in/dw7b6tk hashtag#datascience hashtag#tableau hashtag#sql hashtag#juanalytics",https://www.linkedin.com/posts/jmperafan_datascience-tableau-sql-activity-6504293861580374016-e-Jl,Image,TRUE,Display,Fabian Zimmer | Robert Crocker,FALSE
73,5,61,4,"I claim to be the biggest fan of DataCamp, but it took me embarrassingly long to find out they have a community page full of FREE content. It is full of cheat sheets, tutorials, podcasts, courses, and much more. Here are a couple of examples: Fuzzy Matching with Python: https://lnkd.in/dMUdaUH Spreadsheets with Tableau: https://lnkd.in/dBpaQaq Here is the link: https://lnkd.in/dKQA4xA hashtag#datascience hashtag#datacamp hashtag#juanalytics",https://www.linkedin.com/posts/jmperafan_free-data-science-and-analysis-training-courses-activity-6506170455873843200-YZll,Link,TRUE,Opinion,DataCamp,FALSE
74,5,43,0,"Statistical mantra: You care about the relationship (if any) between two variables... Not just about correlation. Pearson's correlation, the most widely used metric, is good to find linear relationships between two variables. Assuming there are no outliers, both variables are normally distributed, and the data points are equally spread along the line. But what if the relationship can be better explained by something else than a line? You will often be fine by using corr(). But I would like to invite you to plot your data using a scatterplot first. Look for any predictable pattern like a curve, clusters, or a wave. If you find one, consider transform your data or use a different type of correlation (e.g. Kendall and Spearman). Or give up and create a proper model to explain this relationship. hashtag#datascience hashtag#statistics hashtag#juanalytics",https://www.linkedin.com/posts/jmperafan_datascience-statistics-juanalytics-activity-6505769120238170112-NZJF,Image,TRUE,Opinion,,FALSE
75,5,57,9,"Things you should know about NULL values: 1) LEN(0) will catch both NULL and """". 2) In SQL, COUNT(*) will count non-null values and COUNT(1) will return all of the rows. In Tableau, COUNT() and SUM([Number of Records]) will do the same trick. 3) ""NULL"", ""NA"", """" might be cast into strings and commands like IS NULL won't work anymore. 4) NULL is not always random. A boolean column indicating if something is NULL might be a good feature for a model. 5) Missing rows (i.e. rows that are not present in the data) behave differently than a NULL. One thing is to have some respondents not answering a couple of questions and the other is to have some respondents who didn't show up. 6) Consider making a model to input NULL values. Using the mean or removing those rows are not great solutions. 7) Always check your data with a histogram. Some people have a nasty tendency to input the mean or an arbitrary value (e.g. 99, 100, 0, -1) directly into the database. hashtag#datascience hashtag#juanalytics",https://www.linkedin.com/posts/jmperafan_datascience-juanalytics-activity-6506420874084646912-ugCi,Image,TRUE,Display,,FALSE
76,5,15,4,"Have you ever wondered what a good example of a data science portfolio should look like? Check the one from Rhys Tutt. Here are 3 things I would like to highlight from his portfolio: • The design is clean and pleasant. People will decide within 3 seconds if they want to keep on reading your CV or website. Usability and aesthetics are a significant part of that decision. • It has a good number of projects (3 or more). Additionally, the level of detail he uses to describe them shows me that he knows what he is talking about. But it is also not too long so that I won't commit to reading them. • It has an informative blog! Even if I don't have a job for him, I still have a good reason to stay and check his profile. In fact, I would recommend you guys to check them. Link: http://rtuttinsights.com/ hashtag#datascience hashtag#juanalytics",https://www.linkedin.com/posts/jmperafan_home-1-activity-6506809618331635712-Lv3h,Image,TRUE,Opinion,Rhys Tutt,FALSE
77,5,35,3,"I had some time to spare on the train so I decided to practice my formatting skills. The dashboard is far from perfect, but this is an exercise that I think everybody should try. I tried to build a dashboard that resembles the colors of the Brazilian flag. Just like any brand would like a dashboard that resembles its corporate identity. Additionally, I tried to change all of the ""defaults"": •The font is Nirmala instead of Tableau Book •No gridlines •Custom icon •Non-standard map •Different font sizes •The legend is another sheet •Most elements have borders •Blank elements to create white space Here is the link to the workbook: https://lnkd.in/gZEZBCF hashtag#tableau hashtag#juanalytics",https://www.linkedin.com/posts/jmperafan_tableau-juanalytics-activity-6509065833619156993-lMFZ,Image,TRUE,Display,,
78,5,22,2,"Don't you just secretly hate it when people don't like or understand your visualizations and ask you to re-do them? This is also a problem for web designers! The BI community is lucky to have tools like Tableau that allow us to make decent looking graphs in seconds. That, almost completely, removes the need for mockups and re-iterating is generally not a big deal. For web designers, however, coding a website is both expensive and time-consuming. This really pushes them to make sure the site looks good and the interface is intuitive. I firmly believe we could learn a lot from web designers. Here are 3 links that you could try: 1) Nielsen Norman Group articles about UX design: https://lnkd.in/e9sqAhJ 2) Become a usability tester: https://lnkd.in/ew4XDjY 3) LearnUI articles about web design: https://lnkd.in/ebhVTgY hashtag#design hashtag#uxdesign hashtag#usability hashtag#tableau hashtag#juanalytics",https://www.linkedin.com/posts/jmperafan_design-uxdesign-usability-activity-6509386246475837441-QGgS,Image,TRUE,Opinion,,FALSE
79,5,53,8,"Last week, I went to the supermarket and I saw a graph similar to the one above. A very long bar chart showing very tiny differences between the prices of each supermarket. There was something about the graph that bothered me... So, I did the thing that any sane person would do. I spent the next couple of hours googling for the original dataset, I replicated the graph, and I made an improved version. Tip: Bar graphs are not great to show small differences between large quantities. Beginners might try to fix this by changing the starting point of the y-axis. However, not including 0 in your axes can be deceiving. A better alternative can be to transform or centralize those numbers. Next time you run into this problem, consider transforming the numbers into a percentage, subtract it from the mean, turn them into standard deviations from the mean, or use a logarithm transformation. Hopefully one of this will give you a better result. hashtag#dataviz hashtag#datascience hashtag#juanalytics",https://www.linkedin.com/posts/jmperafan_dataviz-datascience-juanalytics-activity-6510837246877274112-DbPZ,Image,TRUE,Display,,
80,5,57,5,"In case you missed it, Ken Flerlage published this wonder last week. It is the first time I see a graph like this and I love it! What a playful and intuitive way of visualizing targets. The cherry on top is that this visualization is relatively easy to make. Any intermediate should be able to replicate it. Here is the link in case you want to reverse engineer it: https://lnkd.in/dQqX5Er hashtag#tableau hashtag#datascience hashtag#juanalytics",https://www.linkedin.com/posts/jmperafan_tableau-datascience-juanalytics-activity-6511224898239627264-m107,Image,FALSE,Display,Ken Flerlage,FALSE
81,5,48,3,"I have completed roughly a dozen of Tableau courses in Udemy. To be honest with you, most of them are not better than the free material that Tableau provides. There are a couple of exceptions though. Today, I want to speak about ""Advanced Tableau - Level of Detail Expressions / LOD"" by R-tutorials. If you are having trouble grasping LOD calculations this is the right course for you! It explains the theory behind LODs and nested LODs. Additionally, he also demonstrates how to do many of the most important application (market basket analysis, cohort analysis, proportional brushing). It is a shame the course only has 1300 enrolled students. Here is the link to the course: https://lnkd.in/dz3ZizY hashtag#tableau hashtag#juanalytics",https://www.linkedin.com/posts/jmperafan_tableau-juanalytics-activity-6512311483462885376-MDLW,Image,TRUE,Accomplishment,R-Tutorials,FALSE
82,5,133,7,"Want to take your Tableau skills to the next level, here are my top 3 Tableau blogs in no particular order: 1) Tableaumagic by Toan Hoang: https://tableaumagic.com 2) Ken Flerlage's blog: https://lnkd.in/dee7-e9 3) Data+Science by Jeffrey Shaffer: https://lnkd.in/dDpcxqJ These are not the only ones I like... But these ones don't fail to deliver great posts on a regular basis. If there is a blog you think belongs on this list, please share! I might not know it. hashtag#tableau hashtag#juanalytics",https://www.linkedin.com/posts/jmperafan_tableau-juanalytics-activity-6508280108871090176-0X23,Image,TRUE,Opinion,Toan Hoang | Ken Flerlage | Jeffrey Shaffer,FALSE
83,5,180,6,The BBC shared a Tableau style guide and a Ggplot2 cookbook for anybody who would like to make print-ready graphs like the ones below. Check them out if you want a clean style template for your next graphs. Tableau: https://lnkd.in/d6ieVuX R: https://lnkd.in/dzUKF_A hashtag#datascience hashtag#tableau hashtag#ggplot2 hashtag#juanalytics,https://www.linkedin.com/posts/jmperafan_datascience-tableau-ggplot2-activity-6507175056475463680-NibW,Image,FALSE,Opinion,BBC,FALSE
84,5,20,7,"Dear Excel lovers, You should seriously consider giving Google Sheets a try. Some people claim that it can handle fewer rows than Excel and the syntax of the formulas and the UI are slightly different. Nevertheless, Google Sheets has some great security features that are harder to implement in Excel. I have learned to treasure how great it is to be able to: • Decide if I want other people to view or edit. • Ask my users to authenticate more than once. • Exclude users outside of a certain VPN to open a file. • Have an overview of everybody who accessed my data. • Prevent others from printing, copying, downloading, or sharing. Let me emphasize this: Google Sheets is not the only solution that allows these capabilities. Maybe your organization is already using OneDrive plus passwords to prevent people from leaking sensitive information. Also, I am not asking you to give up Excel. Just give it a try. I have been using Google Sheets for a couple of personal projects and I love how easy it is to keep my spreadsheets secure, collaborate with others (without worrying about version control), centralize my information, and not pay a dime for it. hashtag#datascience hashtag#security hashtag#juanalytics",https://www.linkedin.com/posts/jmperafan_datascience-security-juanalytics-activity-6514108509452279808-O2Xo,Image,TRUE,Opinion,,FALSE
85,5,43,2,I took some sales courses and learned a thing or two about selling SaaS. I firmly believe that everybody in an organization should know how to sell their own products and services. hashtag#tableau hashtag#juanalytics,https://www.linkedin.com/posts/jmperafan_tableau-juanalytics-activity-6514453294037893120-BCdC,Image,TRUE,Accomplishment,,FALSE
86,5,12,1,"Back in 1976, Bell Laboratories (the same creators of the C language) developed the S language. A programming language made by statisticians and for statisticians. It was designed to load data, model it, and visualize it. This experiment led to the creation of the R language. The below quote comes from one of the creators of S. I wanted to share it with you today. It truly captures why I find R so captivating. hashtag#datascience hashtag#r hashtag#juanalytics",https://www.linkedin.com/posts/jmperafan_datascience-r-juanalytics-activity-6514789011339440129-X3Nb,Image,FALSE,Opinion,,FALSE
87,5,80,8,"Looking for a dataset for your next project? But you are not in the mood for web scrapping, APIs, programming, or broken links? Try these sites! MakeOverMonday (visualization): https://lnkd.in/dg3ufdY R datasets: https://lnkd.in/dUYzuqi UCI Machine Learning repository: https://lnkd.in/dtWMbAS FiveThirtyEight (data journalism): https://lnkd.in/dqWrCdE hashtag#datascience hashtag#juanalytics",https://www.linkedin.com/posts/jmperafan_datascience-juanalytics-activity-6513667843043655680-umqj,Image,TRUE,Opinion,,FALSE
88,4,48,3,"Did you know that you can create a parameter for the size of your bins when you build a histogram in Tableau? It took me an embarrassingly long time to find out. Instead of actually typing a number in the ""Size of bins"" field, you can just click on the little arrow to the right and you get the option to ""create a parameter"". By default, this parameter is set to float with a minimum, maximum, and a step size that depends on your data. But normally you might want to change this to integer and remove the other 3 constraints. hashtag#tableau hashtag#datascience hashtag#juanalytics",https://www.linkedin.com/posts/jmperafan_tableau-datascience-juanalytics-activity-6515869654559260672-qWsF,Image,TRUE,Display,,
89,4,48,1,"After some hours of playing, I managed to find a “Tableau friendly” way of doing sentiment analysis. That is, without having to create a tokenized data frame. I used it to calculate the sentiment of all of Trump’s tweets since he is in office. Feel free to adapt this script to your own needs. Also noteworthy, make sure to check the Sentimentr library. It is great! The syntax is almost as easy as TidyText, you decide how to group your aggregations, and it automatically incorporates weighting for valence shifters. Here is their Github: https://lnkd.in/dAXw7FM hashtag#tableau hashtag#datascience hashtag#juanalytics",https://www.linkedin.com/posts/jmperafan_tableau-datascience-juanalytics-activity-6516252326016094208-3vT7,Image,TRUE,Display,,
90,4,118,12,"I like to keep myself busy. I had several jobs to pay for my studies. Nowadays, I don't need the money. But I still fill my evenings with projects and volunteer work. I think I managed to create a Tableau CV that fully captures that. It almost feels like I am climbing the career ladder in a short amount of time. Check out the interactive version. I added a description of each job when you hover over each hexagon. Here is the link: https://lnkd.in/dDFtRB6 hashtag#tableau hashtag#juanalytics",https://www.linkedin.com/posts/jmperafan_tableau-juanalytics-activity-6516967591905366016-og3_,Image,TRUE,Display,,
91,4,27,1,"Really cool article by Rody Zakovich (Tableau Zen Master) explaining how to do a UI like the one below. Also, make sure to check the Playfairdata blog, it is full of great gems! Here is the link: https://lnkd.in/ej2ezgr hashtag#tableau hashtag#juanalytics",https://www.linkedin.com/posts/jmperafan_tableau-juanalytics-activity-6514428712627290112-jzNy,Image,FALSE,Display,Rody Zakovich,FALSE
92,4,15,1,I have been collecting information about each hotel in which I stayed for almost a year now. Here is an interactive map using most of that information. Two things to highlight from this visualization. 1) I am using Mapbox to make the map more recognizable. 2) Tableau Public syncronizes your data automatically if you use Google Sheets. I just have to add new hotels to my spreadsheet and they will appear there on the next day. I already discussed this in a previous post: https://lnkd.in/djGzs6Z Feel free to check it out and play with it: https://lnkd.in/eaBS2QR hashtag#tableau hashtag#juanalytics,https://www.linkedin.com/posts/jmperafan_tableau-juanalytics-activity-6517346549222170624-JojQ,Image,TRUE,Display,,
93,4,105,14,"It is difficult to get into the R integration in Tableau because most of the tutorials are not great. Most of them are not even made by R users. Consequently, you see countless R scripts that do things that Tableau can do natively or with the help of some calculated fields (e.g. correlation or the example below). Here are some tips about the actual script that I learned the hard way. 1. Most R functions will ask you to provide a data frame, but there is no way to refer to your Tableau environment. More often than not, you will have to create a data frame inside of your script using all of your arguments: df <- data.frame(.arg1, .arg2) 2. You can create multiple data frames inside of your script. However, you can only pull out of a vector of size 1 or as big as your data source per calculated field. This vector should be the last part of your script. 3. The R connection behaves similarly to dplyr::mutate when you create a new column. Most wrangling functions you might want to use on your data source are useless (e.g. tidyr::spread, dplyr::filter). 4. R scripts are Table Calculations. Meaning they are always aggregated with “Compute Using”, you cannot reference them in LOD calculations, and you have to be careful on how to apply filters. hashtag#tableau hashtag#datascience hashtag#juanalytics",https://www.linkedin.com/posts/jmperafan_tableau-datascience-juanalytics-activity-6516638359245328384-zPu9,Image,TRUE,Display,,FALSE
94,4,46,2,"Back in October, I started posting daily tips here on LinkedIn. In a world saturated by content for beginners, my idea was to centralize content for mediors. I checked my LinkedIn data this morning and this was one of the coolest findings. It makes me happy to see that my LinkedIn connections are starting to resemble the type of people I want to reach. hashtag#tableau hashtag#datascience hashtag#juanalytics",https://www.linkedin.com/posts/jmperafan_tableau-datascience-juanalytics-activity-6518772099304157184-CFFZ,Image,TRUE,Display,,
95,4,14,1,"I remade one of the most emblematic ggplot2 graphs in Tableau. I still prefer the original, but it was an interesting exercise. Link to the original graph: https://lnkd.in/d6_mJwU Do you want to learn how to build a joyplot in Tableau? Ken Flerlage made a great template that you could easily copy and adjust, but my advice would be to take time to understand how the graph works, though. Here is the link: https://lnkd.in/dp2eG6g hashtag#tableau hashtag#juanalytics",https://www.linkedin.com/posts/jmperafan_tableau-juanalytics-activity-6519135950994436096-B2Rv,Image,TRUE,Display,Ken Flerlage,
96,4,20,0,"Everybody loves cheatsheets, right? Asif Bhat made an exhaustive and complete collection for anything data science. He took the work to curate such this content well. Make sure to check them out: https://lnkd.in/ede-7Jc hashtag#datascience hashtag#juanalytics",https://www.linkedin.com/posts/jmperafan_abhat222data-science-cheat-sheet-activity-6519492702709567488-Dix4,Link,FALSE,Display,Asif Bhat,FALSE
97,4,19,1,"Simple, yet powerful. With this script, you can detect the language of the string in Tableau using the R integration. Textcat was originally written in Perl, but it is now available in many programming languages (e.g. Go, Python, PHP, C++). In my own experience, it works really well. Here is their Github: https://lnkd.in/d7W37Qv Fun fact, if you remove the punctuation and the stopwords from an English sentence, textcat misclassifies it as being ""Scottish"". hashtag#datascience hashtag#tableau hashtag#nlp hashtag#juanalytics",https://www.linkedin.com/posts/jmperafan_datascience-tableau-nlp-activity-6519851626830790656-S9lT,Image,TRUE,Display,,
98,4,7,0,"If you have ever played with the Tableau superstore data, you might have noticed that some clients get huge discounts. I made this visualization to bring to light purchases that were sold with a significantly big negative loss. 1) By subtracting each profit to the average profit of that same product, the mean becomes 0. Making it easy to compare different products. 2) I used this formula for the size of the dots IIF( [Normalized Profit] > 0 , NULL , ABS([Normalized Profit]) ) Here is the link to the dashboard: https://lnkd.in/dTvyuNR hashtag#tableau hashtag#datascience hashtag#juanalytics",https://www.linkedin.com/posts/jmperafan_tableau-datascience-juanalytics-activity-6520913486032175104-wc3v,Image,TRUE,Display,,
99,4,25,2,"Have you ever wondered if it's cheaper to get 2 medium pizzas or just 1 large? It might seem easy to calculate the price per diameter. Unfortunately, this formula won't actually tell us which pizza is cheaper because of the price increases linearly, but the diameter doesn't. Besides, we don't eat the diameter or the circumference; we eat the area of a pizza. Luckily for us, Archimedes of Syracuse (287–212 BC) did the math for us. I am sure he would feel reassured to know that Domino's takes his formula into account to determine the price of their pizzas (at least here in Belgium). Lesson to be learned: Be careful when you operate with different types of measurements. Mixing numbers with different units or scales can hinder the validity or interpretability of the result. hashtag#datascience hashtag#pizza hashtag#juanalytics",https://www.linkedin.com/posts/jmperafan_datascience-pizza-juanalytics-activity-6521678739573600256-_jFf,Image,TRUE,Display,,
100,4,27,5,"Who needs free time when you can binge read 5 month worth of Data Science tips? I just wanted to let all of you know that I added the hashtag hashtag#juanalytics to the end of ALL of my previous Data Science tips and I will continue doing it from now on. That way, you can easily find all of my posts. Needless to say, feel free to reach out to me if you have suggestions or questions about my posts. I am always up to network with other data people. hashtag#juanalytics.",https://www.linkedin.com/posts/jmperafan_juanalytics-juanalytics-activity-6522130668867190784-TscO,Image,TRUE,Accomplishment,,FALSE
