Id,Months,Likes,Comments,Post,Url,Media,Original,Type,Mention,Effort
33,8,33,3,"I just witness someone picking up a stranger in the library. She seemed particularly uncomfortable and tried to get out of the conversation a handful of times. But she was just a bit too polite to be blunt and leave. I feel Tableau does exactly the same. Tableau is a bit too polite to tell you shouldn't do pie charts. So it allows you to do them... But you have to make them bigger, center them, and add the labels yourself. This is a huge difference compared to other charts (e.g. bar charts) that looks almost print-ready by default. Same applies to the features that are easy to do in Excel, but cumbersome in Tableau. Conditional formatting for multiple rows, more than 16 columns, and evenly spacing columns (just to name a few). Maybe that is just Tableau's polite way to encourage you to adhere to their ideal of best practices and make your data visual, instead of tabular. hashtag#tableau hashtag#juanalytics",https://www.linkedin.com/posts/jmperafan_tableau-juanalytics-activity-6481514899427074048-f9Vw,Image,TRUE,Display,,
34,8,13,5,"I feel BI professionals have been indoctrinated to demonize pie charts. Sure, in the absolute majority of cases, they are a really bad chart. But just for the sake of the argument, I will play the devil's advocate here. Our vision has a hard time comparing angles and this is the biggest criticism of pie charts. However, humans are particularly good at distinguishing right angles (exactly 90°). Pie charts are not a bad option when you want to highlight that one group is exactly 1/4 or 1/2 of the total. With this said, you should probably still not do it. You can't always guarantee that your data will create a right angle and, even when you can, you will still lose BI street cred for using a pie chart. hashtag#juanalytics",https://www.linkedin.com/posts/jmperafan_juanalytics-activity-6481848423287918592-ECDF,Image,TRUE,Display,,
35,8,7,0,"Last week I mentioned some of the benefits of using Google Sheets as your data source when you work with Tableau Public: https://lnkd.in/djGzs6Z But did you know it is also possible to scrape web data using Google Sheets? In the image below, I am using =importhtml(A1, ""table"", 3) to scrape a table from Wikipedia. And you are not limited to work with HTML elements. You can choose between: • = ImportXML() • = ImportHTML() • = ImportFEED() • = ImportDATA() If you are particularly interested in web scraping, I highly recommend you to start playing with Rvest (for R) or Beautiful Soup (for Python). Google Sheets is a quick and dirty way of doing it, but it is not always as flexible as you might want. As a warning, be very careful with the sites you scrape. Your IP might be banned if they catch you and there might be legal implications if you scrape websites without obtaining prior permission. Most of the times, you are better off using a website's API. hashtag#juanalytics",https://www.linkedin.com/posts/jmperafan_juanalytics-activity-6482921382706454528-EfPw,Image,TRUE,Display,,
36,8,50,3,Happy holidays for all of you! hashtag#juanalytics,https://www.linkedin.com/posts/jmperafan_juanalytics-activity-6482997128741285888-UmFp,Image,TRUE,Display,,
37,8,12,1,"Exactly one year ago, I was in my hometown of Cali, Colombia. It was absurdly warm. I had to shower 3 times a day and riding on the bus, full of sweaty people, was a nightmare. This year, I spent Christmas in the Netherlands. Away from my family and it makes me a bit nostalgic. People constantly ask me how they can improve their Tableau Public profile. My advice is to use your own data. Telling stories about yourself is a lot more impactful than any generic MoM dataset. From all of my visualizations, the most meaningful to me are the ones with my own data (my career, the places I have lived, and my hobbies). https://lnkd.in/gZEZBCF Do you have any good examples of vizzes using your own data? hashtag#juanalytics",https://www.linkedin.com/posts/jmperafan_juanalytics-activity-6483318452151939072-Bo8W,Image,TRUE,Display,,
38,8,95,20,"Do you want to learn R? Here is my tip: Start by learning about the Tidyverse, NOT by learning Base R. How can you start learning? 1) Visit the Tidyverse website. It is the prettiest and clearest documentation I have ever seen: https://www.tidyverse.org/ 2) Check out the book ""R for Data Science"" by Hadley Wickham and Garrett Grolemund. It is one of the most complete data science books for beginners I have read. It explains and exemplifies the whole data science cycle. You can read it for free using this link: https://r4ds.had.co.nz/. 3) Try out DataCamp. I am a huge fan of their service. You can use their platform to learn dplyr, ggplot2, stringr, tidyr, purrr, forcats, rmarkdown, shiny, rvest, lubridate, and many more. If you don't know where to start, I would recommend you this course by David Robinson: https://lnkd.in/d67By5v hashtag#juanalytics",https://www.linkedin.com/posts/jmperafan_tidyverse-activity-6483696417943617536-Nw95,Link,TRUE,Opinion,Hadley Wickham | Garrett Grolemund,FALSE
39,8,17,2,"A while back, I came across a surprisingly interesting data challenge. I had to create a formula to identify if somebody's anniversary already happened or not. At first, I thought the solution had something to do with 365 days. But that is inefficient, since you also have to make rules for leap years. In the end, my approach was a combination of DATEDIFF, TODAY, and MAKEDATE. DATEDIFF('day', TODAY(), MAKEDATE(YEAR(TODAY()), MONTH([Date]), DAY([Date]))) < 0 I am sharing this because I am collecting examples of data challenges. Calculations that seem easy, but might take longer to solve than you expected. If you have a particular example and you would like to share it, I would really appreciate it. P.S. I added the Gangnam Style guy because I couldn't find any Latin artist born on the last days of the year. Almost every birthday already happened this year. hashtag#juanalytics",https://www.linkedin.com/posts/jmperafan_juanalytics-activity-6484036844911628288-S1-X,Image,TRUE,Display,,
40,8,45,0,"I made two big mistakes when I first started learning Python. First mistake: Learning for the sake of learning. Instead of understanding what types of problems can Python solve for me, I just started googling. I came across tutorials to create websites, apps, and even video games. I did a handful of them, but I didn't learn much. Second mistake: Once I decided I wanted to learn about Python for data science, I went directly to learn Scikit-learn and Tensorflow. Without understanding the basics. As somebody without a technical background, here is my advise for anybody learning Python: 1) Find a problem that you want to solve with programming first and then decide what to learn. Your path will eventually take you to new applications, frameworks, or languages. But keep focus at first. Mine was to automate reports. 2) Be aware that many tutorials assume that you are familiar with programming concepts. The web is full of Python tutorials made for programmers who already know other programming languages. 3) If you want to learn Python for data science, start by getting familiar with Pandas and Numpy. Machine learning and deep learning can wait. Make sure to get a copy of ""Python for Data Analysis"" by Wes McKinney. hashtag#juanalytics",https://www.linkedin.com/posts/jmperafan_juanalytics-activity-6484411499572916224-Sf-D,Image,TRUE,Opinion,Wes McKinney,FALSE
41,7,27,1,"2018 was a great year full of highlights: I moved to Utrecht, started a new job at Biztory - Tableau EMEA Partner of the Year, I was appointed as Area Director, and I recently started writing daily posts here on LinkedIn. It was a year full of hard work and rewards. Just thinking about it motivates me to work as hard as I can to make 2019 as remarkable as this current year. Happy new year, everybody! hashtag#juanalytics",https://www.linkedin.com/posts/jmperafan_juanalytics-activity-6485552779078172673-Uhwp,Image,TRUE,Accomplishment,,
42,7,47,0,"Using the R integration to calculate linear regression in Tableau. Most of my contacts stopped reading by now, but for those of you who are still here: I highly recommend you this article written by one of my colleagues Catalina Fluerici. I read it for the first time today and it really blew my mind. https://lnkd.in/dzSzVMV hashtag#biztory hashtag#tableau hashtag#r hashtag#regression hashtag#juanalytics",https://www.linkedin.com/posts/jmperafan_simple-linear-regressions-slope-and-intercept-activity-6486182142802952192-zUA8,Link,FALSE,Display,Catalina Fluerici,FALSE
43,7,35,1,"Are you comfortable with SQL, but you still struggle with R and Python? Try sqldf for R and pandasql for Python! These packages allow you to use SQL commands on data frames. They are both very easy to set up and use. Sqldf: https://lnkd.in/dNeaiKV Pandasql: https://lnkd.in/dUCWZaw hashtag#sql hashtag#teamfederer hashtag#datascience hashtag#juanalytics",https://www.linkedin.com/posts/jmperafan_sql-teamfederer-datascience-activity-6486886093189849088-i_ih,Image,TRUE,Display,,
44,7,15,2,"The Australian Open starts in exactly one week. Is this going to be yet another victory for either of the big 3? Or will we see a new face holding the trophy? If you love tennis, just as much as you love data, I can't recommend enough to check out Tennis Nerds Blog. Their work is stunning and very insightful! Also, for those of you who missed it, Ludovic Tavernier and Klaus Schulte made a data essay of the career of Boris Becker. Here is the link: https://lnkd.in/deJJTAC As for me, I also tried a tennis visualization on my own. Here is the link: https://lnkd.in/df9vQqE hashtag#tableau hashtag#tennis hashtag#teamfederer hashtag#juanalytics",https://www.linkedin.com/posts/jmperafan_tableau-tennis-teamfederer-activity-6487929699702964224-MCMg,Image,TRUE,Display,Tennis Nerds Blog | Ludovic Tavernier | Klaus Schulte,
45,7,17,2,"Are you an intermediate Tableau user trying to master the tool? I have a hidden gem for you! Most of the sessions from the Tableau Conferences are recorded and freely available on YouTube! I call them hidden gems because most of these videos have less than 200 views. Check them out and learn as much as you can from Zen Masters, the Tableau development team, consultants, and industry leaders. If you have trouble deciding, here are some of my favorites (in no particular order): • ""LODs of fun"" by Luca Bandini. • ""Ready, set, action!"" by Bethany Lyons • ""What's new with survey data?"" by Steve Wexler • ""New Ways to Visualise Time"" by Andy Cotgreave Here are the links to the playlists: TC New Orleans 2018: https://lnkd.in/dUngf4X TC London 2018: https://lnkd.in/dV66y-X hashtag#juanalytics",https://www.linkedin.com/posts/jmperafan_tableau-conference-europe-2018-youtube-activity-6488367007619129344-Y1Ul,Link,FALSE,Display,Luca Bandini | Bethany Lyons | Steve Wexler | Andy Cotgreave,FALSE
46,7,42,3,"One of my fellow Biztorians, Alexander Philipeit, made a very interesting tutorial on 3D visualizations. It is mesmerizing to watch his dashboard rotate! Here is the link if you want to learn how he did it... Or just make it spin for a while: https://lnkd.in/dXuV_Y2 hashtag#tableau hashtag#biztory hashtag#juanalytics",https://www.linkedin.com/feed/update/urn:li:activity:6488705287229317120/,Gif,FALSE,Display,Alexander Philipeit,FALSE
47,7,23,6,"Would you like to learn SQL beyond SELECT clauses, but you don't really dare to experiment with your company's database? Check out SQL Fiddle and DB-Fiddle! I found out about this site last week and I have created and dropped more tables today than in the rest of my career. SQL Fiddle: http://sqlfiddle.com DB-Fiddle: https://www.db-fiddle.com Also here is a bad joke: A SQL database comes to NoSQL bar and asks if he could join them. In the end, he left because there were no tables. hashtag#sql hashtag#datascience hashtag#juanalytics",https://www.linkedin.com/posts/jmperafan_sql-fiddle-a-tool-for-easy-online-testing-activity-6489154223530340352-T_FY,Link,TRUE,Display,,FALSE
48,7,47,8,"Is text mining in your 2019 new year's resolution? Here are some useful Regex commands that I tend to use quite often! Email: ""^[_]*([a-z0-9]+(\.|_*)?)+@([a-z][a-z0-9-]+(\.|-*\.))+[a-z]{2,6}$"" Dates: ""^^\d{1,2}\/\d{1,2}\/\d{4}$"" URLs: ""^(http:\/\/www\.|https:\/\/www\.|http:\/\/|https:\/\/)?[a-z0-9]+([\-\.]{1}[a-z0-9]+)*\.[a-z]{2,5}(:[0-9]{1,5})?(\/.*)?$"" hashtag#juanalytics",https://www.linkedin.com/posts/jmperafan_juanalytics-activity-6490501988382449664-5U2h,Image,TRUE,Display,,
49,7,23,0,"In the category: Stuff Tableau will allow you to do, but would prefer you not to (for a good reason). Did you know you can adjust the size of your marks? This menu is only accessible from the size legend (yes, the one you always remove). hashtag#tableau hashtag#datascience hashtag#juanalytics",https://www.linkedin.com/posts/jmperafan_tableau-datascience-juanalytics-activity-6490876635309445120-5JpQ,Image,TRUE,Display,,
50,7,169,33,"Are you a beginner and you are wondering which tools you should start learning? Here are some tips: 1) If you can, avoid spending too much time learning in-house software or unpopular tools. Popular tools have bigger communities, more learning resources, and they maximize your chances to get a job. 2) Focus on transferable skills, not tools. Things like statistics, managing stakeholders, and making your work production-friendly are invaluable and always relevant. Programming languages and software probably not. 3) Master at least one tool, but remain tool-agnostic at heart. Knowing a tiny bit of 10 tools is not what will get you a job. However, even if you have a favorite tool, make sure to check the alternatives and be ready to jump to another tool. Remember: 5 years ago, Ruby was one of the most popular programming languages and it has almost disappeared by now. You are working in one of the fastest moving industries out there! Be prepared for anything! Edit: You are hearing this from a Tableau consultant! hashtag#datascience hashtag#juanalytics",https://www.linkedin.com/posts/jmperafan_datascience-juanalytics-activity-6491241446497087488-JchT,Image,TRUE,Opinion,,FALSE
51,7,22,0,"Do you want a one-afternoon kickstart in Machine Learning with R? Try out this article by Trevor Stephens! This article has a special place in my heart. A couple of years back, I started learning how to program. However, I felt constantly frustrated by all of the error prompts. And I just didn't know how to fix my code. Until I found this tutorial. It was the very first time I felt that things made sense. I hope that you guys find it as helpful as I did back then. It can be a bit harder for people without a technical background to get started in Data Science. Just like I did. But this line of work is definitely worth pursuing! Just hang on there, it will become easier the more you learn. hashtag#juanalytics",https://www.linkedin.com/posts/jmperafan_titanic-getting-started-with-r-activity-6491637349888331776-CZbp,Link,FALSE,Opinion,Trevor Stephens,FALSE
52,7,72,17,"Here is a list of interesting data people you probably don't follow yet (in alphabetic order). Let me know in the comments who are your top data people to follow! :) Adrian Olszewski: Biostatistician and advanced R user. This guy really knows his statistics! I admire his conviction that not every statistician should be a data scientist. Karthikeyan P.T.R.: He makes daily data science posts. Check the comments on his posts, you can often see very fruitful discussions. Naveen Reddy: Grandmaster of Workout Wednesdays and Alteryx Challenges. It is inspiring to see his dedication. Robert Crocker: Data Viz expert and JavaScript user. He recently posted an article about making Tableau extensions. Shane Liyanage: Tennis lover and king of sports visualizations. His Tableau skills are stunning and his tennis analysis are quite informative! hashtag#juanalytics",https://www.linkedin.com/posts/jmperafan_juanalytics-activity-6491966985826504704-KV2F,None,TRUE,Opinion,Adrian Olszewski | Karthikeyan P.T.R. | Naveen Reddy | Robert Crocker | Shane liyanage,FALSE
53,7,48,3,"3 cognitive biases everyone should know: Availability heuristic: We over-represent events based on how easy it is to recall them. Not on how often they happen. We often hear about those startups like Uber, Tesla, or Airbnb, but we almost never hear about those who go bankrupt. Sunk-cost fallacy: The more we invest in something, the more we feel committed to making it work. Even if it is a bad idea. Like when companies invest in a stack that is not right for them, but they try to make it work because ""we spent too much on this"". Functional Fixedness: The more we use an object in a certain way, the harder it becomes to think of other uses for that same object. Why is it that we always look for a hammer when we need to stick a nail into a wall? In most cases, any heavy object would do. hashtag#juanalytics",https://www.linkedin.com/posts/jmperafan_juanalytics-activity-6493428971202453504-XHkY,Image,TRUE,Opinion,,FALSE
54,7,16,3,"In the category: Amazing Tableau blogs that more people should know about! Make sure to check Tableaumagic by Toan Hoang! There are great articles about unusual graph types, databases, and even more advanced topics like the JavaScript API and web data connectors. My favorite, by far, is this tool that takes an image and gives you an XML code that you can use as a custom color palette in Tableau. https://lnkd.in/dpkapcX Here is the link to his blog: https://tableaumagic.com/ hashtag#tableau hashtag#datascience hashtag#juanalytics",https://www.linkedin.com/posts/jmperafan_home-activity-6493783468932104192-WXQz,Link,FALSE,Opinion,Toan Hoang,FALSE
55,7,50,14,One of my colleagues just shared this jewel. Can’t unsee. hashtag#tableau hashtag#juanalytics,https://www.linkedin.com/posts/jmperafan_tableau-juanalytics-activity-6494465126584848384-ocbE,Image,FALSE,Joke,,FALSE
56,7,97,7,"For those of you who think that bar charts are boring, make sure to check Xenographics! It is a website full of exotics graphs! One of my favorites ones is the Spark Bar Chart by Adam McCann. Link to the Xenographics: https://xeno.graphics/ hashtag#tableau hashtag#datascience hashtag#juanalytics",https://www.linkedin.com/posts/jmperafan_tableau-datascience-juanalytics-activity-6494486976962527232-rgn3,Image,FALSE,Opinion,Adam McCann,FALSE
57,6,17,0,"MoM W3: Energy Use at 10 Downing Street I generally don't join MoM challenges, but this time I couldn't resist. Energy data is perfect to practice the use of datetimes and also table calculations. Link: https://lnkd.in/dDdVZyt hashtag#makeovermonday hashtag#tableau hashtag#juanalytics",https://www.linkedin.com/posts/jmperafan_makeovermonday-tableau-juanalytics-activity-6495565907455148032-wcHo,Image,TRUE,Display,,
58,6,98,12,"Do you want to keep your numeric labels short, but some of your data points are either too small or too big for using K, M, or B? Try this formula: IF SUM([Sales]) >= 1000000000 THEN STR(ROUND(SUM([Sales])/1000000000,1)) + 'B' ELSEIF SUM([Sales]) >= 1000000 THEN STR(ROUND(SUM([Sales])/1000000,1)) + 'M' ELSE STR(ROUND(SUM([Sales])/1000,1)) + 'K' END hashtag#tableau hashtag#datascience hashtag#juanalytics",https://www.linkedin.com/posts/jmperafan_tableau-datascience-juanalytics-activity-6495947502259367936-0DhW,Image,TRUE,Display,,
59,6,12,0,"Eastern is officially celebrated on the first Sunday after the ecclesiastical full moon that occurs on or soonest after 21 March. In the early days of the church, a lot of controversies arose because they couldn’t really agree on how to translate Easter (based on a lunar calendar) to the Gregorian calendar. Thousands of years later, we have Tableau and Paul Crawfort built this amazing calculation to help us do exactly that. I know there are better ways of doing this… But I just think we should all behold at the exquisiteness of this masterpiece. Here is the link: https://lnkd.in/dxkjynQ hashtag#tableau hashtag#datascience hashtag#juanalytics",https://www.linkedin.com/posts/jmperafan_tableau-datascience-juanalytics-activity-6496312516115726336-D__w,Image,FALSE,Display,,FALSE
60,6,16,2,"Two visualizations for the price of one using a parameter. Old trick, but golden. Let's be honest, most of the times, you really don't want to see exactly the same visualization in two different ways. However, this trick is particularly useful to ""drill-down"" on the granularity level. I have seen some interesting use cases. There was this dashboard that allowed you to click on a dot in a scatterplot (representing an employee) and that would drill down to all of the details of that person. Here is how to do it: https://lnkd.in/eigfqpU hashtag#tableau hashtag#datascience hashtag#juanalytics",https://www.linkedin.com/posts/jmperafan_use-parameters-to-add-multiple-views-to-your-activity-6496653722813292544-yl14,Link,FALSE,Display,,FALSE
61,6,50,4,"I have never read any of Jane Austen’s novels and, chances are, I never will. But I just found out which ones have a happy ending and which ones don't. I really love analyzing sentiment over time! Here is the link to the dashboard: https://lnkd.in/gZEZBCF hashtag#juanalytics",https://www.linkedin.com/posts/jmperafan_juanalytics-activity-6497071125862838272-yrPI,image,TRUE,Display,,
62,6,32,1,"Most types of graphs are not made for big data. Leaving performance aside, visualizing so much data is a design problem. Have you ever seen Scatterplots, bar charts, or pie charts with WAY too many categories? They are unusable. If you want to learn how to visualize big data, here are my two tips: 1) Check out this talk by Jade Le Van and Florian Ramseger about visualizing high-density data: https://lnkd.in/deyJibj 2) For the R-users, check these two links: Trelliscopejs: https://lnkd.in/dKae6Sg geom_hex: https://lnkd.in/d-m24SZ As for the graph below, that's my attempt to create LOD hexbins using Tableau. I built it a while back, but I am seriously considering revamping it. hashtag#tableau hashtag#datascience hashtag#juanalytics",https://www.linkedin.com/posts/jmperafan_tableau-datascience-juanalytics-activity-6498183335288795136-kN03,image,TRUE,Display,Jade Le Van | Florian Ramseger,
63,6,18,2,Can your dashboards actually withstand the 5-seconds test? It is a pleasure for me to share with my very first official Biztory blog post with all of you. It is about visual hierarchy and design. Here is the link: https://lnkd.in/dxCEUNd hashtag#tableau hashtag#biztory hashtag#juanalytics,https://www.linkedin.com/posts/jmperafan_visual-hierarchy-can-your-dashboard-withstand-activity-6498508408252035072-YTRM,Link,TRUE,Display,Biztory,
64,6,6,1,"In case you missed it, the 30 Tableau Zen Masters of 2019 were just announced. Fresh out of the oven. Edward Beaurain made a great list for us already, in case you want to follow them here on LinkedIn. hashtag#juanalytics",https://www.linkedin.com/posts/jmperafan_data-tableau-makeovermondays-activity-6498835599192006656-9rjX,Image,FALSE,Opinion,Edward Beaurain,FALSE
65,6,22,0,"Make sure not to miss this interactive map of the history of Data Visualizations coded by RJ Andrews. It is flawlessly good. Here is the link: https://lnkd.in/djXa37H Also recommended, he wrote an essay with an explanation of how it works. It is kind of the ""making of"": https://lnkd.in/d8enB7g hashtag#juanalytics",https://www.linkedin.com/posts/jmperafan_map-of-dataviz-firsts-activity-6499254932158316544-4DjO,Link,FALSE,Opinion,RJ Andrews,FALSE
66,6,27,0,"Analyzing data is as easy as cooking a chicken. For most of us, cooking a chicken is a matter of going to the supermarket, paying for it, and cooking it. Seamless and effortless. We even forget that somebody actually raised that chicken, killed it, and spent hours preparing it. Way before it arrived in a neat plastic package to your local store. I have spent a big portion of the year curating and preparing datasets in Tableau for web edit. Making dozens of joins, creating SQL views, writing nested LOD, implementing row-line security, and using INCLUDE to avoid problems with duplicates. Essentially plucking and gutting those data sources, so that the end users have a seamless experience. And I am not even the one who built the data warehouse. hashtag#juanalytics",https://www.linkedin.com/posts/jmperafan_juanalytics-activity-6500682199812046848--CbH,Image,TRUE,Opinion,,FALSE
67,6,37,8,"Phrases that a Tableau Consultant loves to hear: 1. ""But this is a lot easier in Excel... "" 2. ""Yeah, I have seen the options, but I still want the pie"" 3. ""But we always do it this way"" 4. ""I know action filters are faster, but we prefer quick filters"" 5. ""The database guy is on holidays"" 6. ""They told us you could do everything with web edit"" 7. ""How can I export this into Excel?"" 8. ""How can I make a crosstab with more than 17 columns?"" 9. ""Why is the date range filter not updating?"" 10. ""Does it support 3D graphs?"" Did I miss any? hashtag#juanalytics",https://www.linkedin.com/posts/jmperafan_juanalytics-activity-6501073558414860288-PULG,Image,TRUE,Joke,,FALSE
68,6,15,2,"Tableau Tip: Just because Tableau will allow you to abuse it, that doesn't mean you should. Tableau Desktop is a data visualization tool! It is exceptional when it comes to transforming queries into graphs. On top of that, it allows you to do calculations and diverse ETL tasks. Be aware, however, Tableau Desktop is still not an ETL tool. As somebody who has built 8-layers nested LOD calculation, I can confidently tell you: If your solutions and calculations start feeling too complex, you might want to solve them directly in your data. Or start using Tableau Prep. hashtag#tableau hashtag#juanalytics",https://www.linkedin.com/posts/jmperafan_tableau-juanalytics-activity-6501441313076973568-dbwJ,Image,TRUE,Opinion,,FALSE
